{
  "id": "ad3c",
  "title": "Оптимизировать количество Vercel deployments",
  "status": "in_progress",
  "createdAt": "2026-10-06T07:32:51Z",
  "updatedAt": "2026-10-06T07:50:00Z",
  "description": "Снизить количество ненужных Vercel deployments, сохранив Preview для релевантных PR и Production для релевантных изменений в main. Исходный запрос: Issue #109.",
  "requirements": [
    "Добавить version-controlled Vercel Ignored Build Step.",
    "Пропускать deployment для документации, тестов, task metadata, GitHub workflow и agent-only изменений.",
    "Распознавать version-only bump package.json/package-lock.json и не создавать второй эквивалентный production deployment.",
    "Не пропускать изменения приложения, зависимостей, Next.js-конфигурации, scripts и прочей runtime/build-конфигурации.",
    "Сохранить Preview deployments для релевантных PR.",
    "Сохранить Production deployments для релевантных изменений в main.",
    "Документировать deployment-trigger'ы и правила ignore."
  ],
  "definitionOfReady": [
    "Исходные требования зафиксированы в #109.",
    "Создан TASK-ad3c (#111).",
    "Проверены GitHub Actions и отсутствие отдельного Vercel deploy workflow.",
    "Проверена возможность решить фильтрацию через vercel.json ignoreCommand."
  ],
  "acceptanceCriteria": [
    "Изменения только в docs, tests, tasks, .github или skills не запускают Vercel build.",
    "Version-only изменения package.json/package-lock.json не запускают отдельный deployment.",
    "Изменения app, components, lib, public, scripts, dependencies и build/runtime config запускают deployment.",
    "Preview deployment для релевантного PR сохраняется.",
    "Production deployment из main для релевантного изменения сохраняется.",
    "Документация описывает схему deployment-trigger'ов.",
    "npm run tasks:validate проходит.",
    "npm run test:run проходит.",
    "npm run build проходит."
  ],
  "technicalApproach": [
    "Добавить vercel.json с ignoreCommand.",
    "Реализовать scripts/vercel-ignore.mjs для фильтрации changed files и узкого version-only diff.",
    "Добавить unit-тесты для path filtering.",
    "Добавить docs/vercel-deployments.md."
  ],
  "definitionOfDone": [
    "Все изменения находятся в task/ad3c-vercel-deploy-optimization.",
    "Task metadata обновлена.",
    "Реализация, тесты и документация добавлены.",
    "npm run tasks:validate, npm run test:run и npm run build выполнены.",
    "Открыт PR в main с ссылкой на #109 и #111."
  ],
  "decisionLog": [
    {"date":"2026-10-06T07:45:00Z","decision":"Использовать vercel.json ignoreCommand.","reason":"Сохраняет Preview/Production для релевантных изменений и позволяет пропускать нерелевантные коммиты."},
    {"date":"2026-10-06T07:45:00Z","decision":"Version-only bump считать нерелевантным только после semantic comparison JSON.","reason":"Изменения зависимостей или других package fields не должны быть ошибочно пропущены."}
  ],
  "commits": [
    {"sha":"dc3aff3606f5f4c6a3d392b4c02a4bf60334219b","message":"feat: ad3c | register deployment optimization task"},
    {"sha":"0ad8430da420c7c2c5b44dcd4a912e71e012a1c2","message":"feat: ad3c | add deployment optimization task to registry"},
    {"sha":"3c2765fae6338af96ae351867b051f74bffc2248","message":"feat: ad3c | add Vercel ignored build command"},
    {"sha":"833dfe133ff5e247ec5bd117fad98b95aa384918","message":"feat: ad3c | filter unnecessary Vercel deployments"},
    {"sha":"1f8497e38e2f372099b232973844726bf6e2b5bb","message":"test: ad3c | cover Vercel deployment filtering"},
    {"sha":"298a862e15837914fb77fef40845755424af4566","message":"docs: ad3c | document Vercel deployment triggers"},
    {"sha":"1fe07782e8a90d4e753982aa38247b4438500180","message":"chore: ad3c | record implementation history"},
    {"sha":"0d916669a66c020fa99f778c208a50f6a9c2fb28","message":"fix: ad3c | add types for Vercel ignore script"}
  ],
  "history": [
    {"date":"2026-10-06T07:32:51Z","status":"draft","action":"Создан TASK-ad3c на основе Issue #109."},
    {"date":"2026-10-06T07:40:00Z","status":"in_progress","action":"Создан task/ad3c-vercel-deploy-optimization и начата реализация."},
    {"date":"2026-10-06T07:45:00Z","status":"in_progress","action":"Добавлены vercel.json, ignore script, тесты и документация; история коммитов записана в Task metadata."},
    {"date":"2026-10-06T07:50:00Z","status":"in_progress","action":"CI выявил только TypeScript declaration issue для импортируемого .mjs; добавлена .d.mts декларация."}
  ],
  "relations": []
}
